[
  {
    "name": "**Other AI email clients** (Canary Mail, Shortwave, Spike, etc.)",
    "section": "not_approved",
    "category": "Not Approved",
    "provider": null,
    "description": null,
    "approved_for_text": null,
    "not_approved_for_text": null,
    "reason_not_approved": "Not approved; admin-level permissions risk",
    "notes": "Use Microsoft 365 Copilot instead",
    "approved_classifications": [],
    "access_links": [],
    "source": null
  },
  {
    "name": "**Other AI meeting bots** (Otter.ai, Notion AI, Sembly, etc.)",
    "section": "not_approved",
    "category": "Not Approved",
    "provider": null,
    "description": null,
    "approved_for_text": null,
    "not_approved_for_text": null,
    "reason_not_approved": "Admin-level meeting permissions; not approved",
    "notes": "Use Zoom AI Companion or M365 Copilot in Teams instead",
    "approved_classifications": [],
    "access_links": [],
    "source": null
  },
  {
    "name": "Anthropic Claude (public cloud service)",
    "section": "not_approved",
    "category": "Not Approved",
    "provider": null,
    "description": null,
    "approved_for_text": null,
    "not_approved_for_text": null,
    "reason_not_approved": "Did not pass required reviews; not approved for Stanford/SLAC data",
    "notes": "Claude models available via SLAC AI Accelerator and Stanford AI Playground",
    "approved_classifications": [],
    "access_links": [],
    "source": null
  },
  {
    "name": "ChatGPT (OpenAI – public)",
    "section": "not_approved",
    "category": "Not Approved",
    "provider": null,
    "description": null,
    "approved_for_text": null,
    "not_approved_for_text": null,
    "reason_not_approved": "Did not pass required reviews; not approved for Stanford/SLAC data",
    "notes": "Similar models available via Stanford AI Playground",
    "approved_classifications": [],
    "access_links": [],
    "source": null
  },
  {
    "name": "Claude Code (public/direct)",
    "section": "not_approved",
    "category": "Not Approved",
    "provider": null,
    "description": null,
    "approved_for_text": null,
    "not_approved_for_text": null,
    "reason_not_approved": "Not approved for Stanford data as a standalone tool",
    "notes": "Use via SLAC AI Accelerator API hub (SLAC) or AI API Gateway (Stanford)",
    "approved_classifications": [],
    "access_links": [],
    "source": null
  },
  {
    "name": "Claude in Excel",
    "section": "not_approved",
    "category": "Not Approved",
    "provider": null,
    "description": null,
    "approved_for_text": null,
    "not_approved_for_text": null,
    "reason_not_approved": "Under new review; not currently approved",
    "notes": "—",
    "approved_classifications": [],
    "access_links": [],
    "source": null
  },
  {
    "name": "Cursor",
    "section": "not_approved",
    "category": "Not Approved",
    "provider": null,
    "description": null,
    "approved_for_text": null,
    "not_approved_for_text": null,
    "reason_not_approved": "Not under review; not approved for Stanford data",
    "notes": "—",
    "approved_classifications": [],
    "access_links": [],
    "source": null
  },
  {
    "name": "DeepSeek (public)",
    "section": "not_approved",
    "category": "Not Approved",
    "provider": null,
    "description": null,
    "approved_for_text": null,
    "not_approved_for_text": null,
    "reason_not_approved": "Not currently under review; not approved for Stanford/SLAC data",
    "notes": "DeepSeek models available via Stanford AI Playground",
    "approved_classifications": [],
    "access_links": [],
    "source": null
  },
  {
    "name": "Fireflies.ai",
    "section": "not_approved",
    "category": "Not Approved",
    "provider": null,
    "description": null,
    "approved_for_text": null,
    "not_approved_for_text": null,
    "reason_not_approved": "Admin-level meeting permissions; not approved",
    "notes": "Use Zoom AI Companion or M365 Copilot in Teams instead",
    "approved_classifications": [],
    "access_links": [],
    "source": null
  },
  {
    "name": "Google Drive M365 Copilot connector",
    "section": "not_approved",
    "category": "Not Approved",
    "provider": null,
    "description": null,
    "approved_for_text": null,
    "not_approved_for_text": null,
    "reason_not_approved": "Under review; not currently approved",
    "notes": "—",
    "approved_classifications": [],
    "access_links": [],
    "source": null
  },
  {
    "name": "Google Gemini (unauthenticated / personal account)",
    "section": "not_approved",
    "category": "Not Approved",
    "provider": null,
    "description": null,
    "approved_for_text": null,
    "not_approved_for_text": null,
    "reason_not_approved": "Not approved for Stanford data without Stanford account login",
    "notes": "Use via [gemini.google.com](https://gemini.google.com) with Stanford account instead",
    "approved_classifications": [],
    "access_links": [],
    "source": null
  },
  {
    "name": "Google Gemini for Workspace",
    "section": "not_approved",
    "category": "Not Approved",
    "provider": null,
    "description": null,
    "approved_for_text": null,
    "not_approved_for_text": null,
    "reason_not_approved": "Cannot be purchased due to Google licensing limitations",
    "notes": "UIT is working with Google on a future solution",
    "approved_classifications": [],
    "access_links": [],
    "source": null
  },
  {
    "name": "Google NotebookLM Plus",
    "section": "not_approved",
    "category": "Not Approved",
    "provider": null,
    "description": null,
    "approved_for_text": null,
    "not_approved_for_text": null,
    "reason_not_approved": "Cannot be purchased due to Google licensing limitations",
    "notes": "Use standard NotebookLM instead",
    "approved_classifications": [],
    "access_links": [],
    "source": null
  },
  {
    "name": "Grammarly (non-Education versions)",
    "section": "not_approved",
    "category": "Not Approved",
    "provider": null,
    "description": null,
    "approved_for_text": null,
    "not_approved_for_text": null,
    "reason_not_approved": "Vendor does not support required service agreements for non-Education versions",
    "notes": "Use Grammarly Education with TSA+BAA only",
    "approved_classifications": [],
    "access_links": [],
    "source": null
  },
  {
    "name": "Grok",
    "section": "not_approved",
    "category": "Not Approved",
    "provider": null,
    "description": null,
    "approved_for_text": null,
    "not_approved_for_text": null,
    "reason_not_approved": "Not approved for SLAC use",
    "notes": "Listed as prohibited by SLAC IT",
    "approved_classifications": [],
    "access_links": [],
    "source": null
  },
  {
    "name": "Microsoft Copilot (unauthenticated)",
    "section": "not_approved",
    "category": "Not Approved",
    "provider": null,
    "description": null,
    "approved_for_text": null,
    "not_approved_for_text": null,
    "reason_not_approved": "Not approved for Stanford data; does not require SUNet ID sign-in",
    "notes": "Use Authenticated Copilot Chat instead",
    "approved_classifications": [],
    "access_links": [],
    "source": null
  },
  {
    "name": "OpenClaw / Clawdbot / Moltbot",
    "section": "not_approved",
    "category": "Not Approved",
    "provider": null,
    "description": null,
    "approved_for_text": null,
    "not_approved_for_text": null,
    "reason_not_approved": "Not under review; not approved",
    "notes": "—",
    "approved_classifications": [],
    "access_links": [],
    "source": null
  },
  {
    "name": "Perplexity",
    "section": "not_approved",
    "category": "Not Approved",
    "provider": null,
    "description": null,
    "approved_for_text": null,
    "not_approved_for_text": null,
    "reason_not_approved": "Vendor does not support required service agreements",
    "notes": "Not under review",
    "approved_classifications": [],
    "access_links": [],
    "source": null
  },
  {
    "name": "Read.ai",
    "section": "not_approved",
    "category": "Not Approved",
    "provider": null,
    "description": null,
    "approved_for_text": null,
    "not_approved_for_text": null,
    "reason_not_approved": "Admin-level meeting permissions; not approved",
    "notes": "Use Zoom AI Companion or M365 Copilot in Teams instead",
    "approved_classifications": [],
    "access_links": [],
    "source": null
  },
  {
    "name": "Serper AI",
    "section": "not_approved",
    "category": "Not Approved",
    "provider": null,
    "description": null,
    "approved_for_text": null,
    "not_approved_for_text": null,
    "reason_not_approved": "Vendor does not support required service agreements",
    "notes": "—",
    "approved_classifications": [],
    "access_links": [],
    "source": null
  },
  {
    "name": "Superhuman",
    "section": "not_approved",
    "category": "Not Approved",
    "provider": null,
    "description": null,
    "approved_for_text": null,
    "not_approved_for_text": null,
    "reason_not_approved": "Did not pass required reviews; no required service agreements",
    "notes": "Use Microsoft 365 Copilot for email AI instead",
    "approved_classifications": [],
    "access_links": [],
    "source": null
  },
  {
    "name": "Zapier",
    "section": "not_approved",
    "category": "Not Approved",
    "provider": null,
    "description": null,
    "approved_for_text": null,
    "not_approved_for_text": null,
    "reason_not_approved": "Not HIPAA-compliant; no enterprise license candidate",
    "notes": "—",
    "approved_classifications": [],
    "access_links": [],
    "source": null
  },
  {
    "name": "AWS Bedrock (SLAC)",
    "section": "slac",
    "category": "SLAC-Specific",
    "provider": "AWS – SLAC-managed cloud",